NCTId,Sponsor,Locations
NCT00315133,University of Sao Paulo,"Hospital das Clínicas da Faculdade de Medicina de Ribeirão Preto da Universidade de São Paulo, Ribeirão Preto, Brazil"
NCT03743649,M.D. Anderson Cancer Center,"Hosptial de Cancer de Barretos, Barretos, Brazil"
NCT00757978,Hospital de Clinicas de Porto Alegre,"Hospital de Clinicas de Porto Alegre, Porto Alegre, Brazil"
NCT00543725,"Tibotec Pharmaceuticals, Ireland",", Campinas, Brazil; , Distrito Barao Geraldo-Campina, Brazil; , Pinheiros, Brazil; , Recife, Brazil; , São Paulo, Brazil"
NCT00659308,Federal University of São Paulo,"Federal University of Sao Paulo, São Paulo, Brazil"
NCT04015674,Hospital de Clinicas de Porto Alegre,"Hospital de Clinicas de Porto Alegre, Porto Alegre, Brazil"
NCT00949533,Hoffmann-La Roche,", Curitiba, Brazil; , São Paulo, Brazil; , São Paulo, Brazil"
NCT02208791,University of Sao Paulo General Hospital,"Hospital das Clinicas - Faculdade de Medicina da Universidade de São Paulo, São Paulo, Brazil"
NCT07091747,Federal University of Latin American Integration,"Universidade Federal da Integração Latino-Americana, Foz do Iguaçu, Brazil"
NCT00834938,"University of Campinas, Brazil","LIMED (Laboratory of Investigation of Metabolism and Diabetes)/GASTROCENTRO/Univeristy of Campinas (UNICAMP), Campinas, Brazil"
NCT02682355,"Rutgers, The State University of New Jersey","Hospital Sao Lucas da - PUC / RS, Porto Alegre, Brazil; Hospital Moinhos de Vento, Porto Alegre, Brazil"
NCT00747526,"Janssen Research & Development, LLC",", São Paulo, Brazil"
NCT02648347,Akebia Therapeutics,"Research Site, Fortaleza, Brazil; Research Site, Fortaleza, Brazil; Research Site, Vitória, Brazil; Research Site, Feira de Santana, Brazil; Research Site, Itabuna, Brazil; Research Site, Belo Horizonte, Brazil; Research Site, Juiz de Fora, Brazil; Research Site, Curitiba, Brazil; Research Site #1, Curitiba, Brazil; Research Site #2, Curitiba, Brazil; Research Site, Maringá, Brazil; Research Site, Rio de Janeiro, Brazil; Research Site, Canoas, Brazil; Research Site, Caxias do Sul, Brazil; Research Site, Passo Fundo, Brazil; Research Site, Porto Alegre, Brazil; Research Site, Porto Alegre, Brazil; Research Site, Porto Alegre, Brazil; Research Site, Porto Alegre, Brazil; Research Site, Criciúma, Brazil; Research Site, Joinville, Brazil; Research Site, Botucatu, Brazil; Research Site, Campinas, Brazil; Research Site, Santo André, Brazil; Research Site, Santo André, Brazil; Research Site, São Bernardo do Campo, Brazil; Research Site, São Paulo, Brazil; Research Site, São Paulo, Brazil; Research Site, São Paulo, Brazil"
NCT03409315,University Medical Center Groningen,"Hélio Fraga Reference Center, Rio de Janeiro, Brazil"
NCT07156708,Federal University of Pelotas,"Escola Superior de Educação Física e Fisioterapia, Pelotas, Brazil"
NCT04889040,Hoffmann-La Roche,"L2 Ip Instituto de Pesquisas Clinicas Ltda ME; Centro Medico Hospitalar, Brasília, Brazil; Chronos Pesquisa Clinica, Taguatinga, Brazil; Hospital Nossa Senhora das Graças, Curitiba, Brazil; Hospital Agamenon Magalhães, Recife, Brazil; Conjunto Hospitalar do Mandaqui, São Paulo, Brazil"
NCT02437552,University of Sao Paulo,"Policlínica Pato Branco, Pato Branco, Brazil"
NCT03263247,São Paulo State University,"University of Sao Paulo, São Paulo, Brazil"
NCT02815358,Federal University of Health Science of Porto Alegre,"Federal University of Health Sciences of Porto Alegre, Porto Alegre, Brazil"
NCT01667315,Federal University of São Paulo,"Federal University of Sao Paulo, São Paulo, Brazil"
NCT03090217,Federal University of Health Science of Porto Alegre,"Comitê de Ética em Pesquisa - Santa Casa de Misericórdia de Porto Alegre, Porto Alegre, Brazil"
NCT01265121,University of Sao Paulo General Hospital,"General Hospital of the University of São Paulo, São Paulo, Brazil"
NCT02043314,Oswaldo Cruz Foundation,"Synchrophar - Ass. e Desenv. de Projetos Clínicos Ltda., Campinas, Brazil"
NCT02161614,Federal University of Minas Gerais,"Hospital das Clinicas - Universidade Federal de Minas Gerais, Belo Horizonte, Brazil"
NCT06570616,University of Sao Paulo General Hospital,"Sleep Laboratory, Heart Institute, Pulmonary Division, Hospital das Clínicas da Universidade de São Paulo, São Paulo, Brazil; InCor - Instituto do Coração do Hospital das Clínicas da FMUSP, São Paulo, Brazil"
NCT00302016,Novartis Pharmaceuticals,"Novartis Investigative Site, Belo Horizonte, Brazil; Novartis Investigative Site, Brasilia-DF, Brazil; Novartis Investigative Site, Campinas, Brazil; Novartis Investigative Site, Curitaba, Brazil; Novartis Investigative Site, Curitiba, Brazil; Novartis Investigative Site, Porto Alegre-RS, Brazil; Novartis Investigative Site, Ribeirão Preto, Brazil; Novartis Investigative Site, Rio de Janeiro, Brazil; Novartis Investigative Site, São Paulo, Brazil"
NCT06068504,University of Nove de Julho,"University Nove de Julho, São Paulo, Brazil"
NCT04911946,University of Sao Paulo General Hospital,"Instituto de Ortopedia e Traumatologia do Hospital das Clinicas da Faculdade de Medicina da Universidade de São Paulo, São Paulo, Brazil"
NCT03154970,Universidade Federal de Santa Maria,"Universidade Federal de Santa Maria, Santa Maria, Brazil"
NCT05403541,Immunovant Sciences GmbH,"Site Number - 5501, Ribeirão Preto, Brazil; Site Number- 5503, Rio de Janeiro, Brazil"
NCT01354054,University of Iowa,"Department of Physical Therapy Federal university of Sergipe, Aracaju, Brazil"
NCT06917794,D'Or Institute for Research and Education,"Instituto D'Or de Pesquisa e Ensino, Fortaleza, Brazil; CPOC - Centro de Pesquisa Oncológica e Clínica, faz parte do Complexo Associação Obras Sociais lrmã Dulce (AOSID), Salvador, Brazil; Instituto D'Or de Pesquisa e Ensino, Salvador, Brazil; Instituto D'Or de Pesquisa e Ensino, Brasília, Brazil; Instituto D'Or de Pesquisa e Ensino, Curitiba, Brazil; Instituto D'Or de Pesquisa e Ensino, Recife, Brazil; Instituto D'Or de Pesquisa e Ensino, Rio de Janeiro, Brazil; Instituto D'Or de Pesquisa e Ensino, São Paulo, Brazil; Instituto do Câncer do Estado de São Paulo, São Paulo, Brazil"
NCT04512651,Universidade Estadual do PiauÍ,"Laiana Sepúlveda de Andrade Mesquita, Teresina, Brazil"
NCT04315142,University of Zurich,"University of Sao Paulo School of Medicine, São Paulo, Brazil"
NCT01998386,University of Nove de Julho,"University of Nove de Julho, São Paulo, Brazil"
NCT06141486,Sanofi,"Centro de Pesquisas da Clínica IBIS- Site Number : 0760030, Salvador, Brazil; L2IP - Instituto de Pesquisas Clínicas- Site Number : 0760003, Brasília, Brazil; Universidade Federal de Goias- Site Number : 0760024, Goiânia, Brazil; Freire Pesquisa Clínica - Belo Horizonte - Rua Piauí- Site Number : 0760025, Belo Horizonte, Brazil; Instituto de Neurologia de Curitiba - Ecoville- Site Number : 0760001, Curitiba, Brazil; Hospital Moinhos de Vento- Site Number : 0760005, Porto Alegre, Brazil; Clínica Neurológica- Site Number : 0760007, Joinville, Brazil; Prognosis Pesquisa Clinica- Site Number : 0760032, Santo André, Brazil; CPQuali Pesquisa Clinica - São Paulo- Site Number : 0760002, São Paulo, Brazil; PSEG Centro de Pesquisa Clínica- Site Number : 0760021, São Paulo, Brazil; Jordy Sinapse- Site Number : 0760004, São Paulo, Brazil"
NCT01297972,University of Sao Paulo,"Hospital das Clínicas da Faculdade de Medicina de Ribeirão Preto da Universidade de São Paulo, Ribeirão Preto, Brazil"
NCT00933205,Boehringer Ingelheim,"1182.16.5511 Unidade de Pesquisa Clínica (UPC) - AIDS, Campinas - Sp, Brazil; 1182.16.5505 Hospital São José de Doenças Infecciosas de Fortaleza, Fortaleza - Ce, Brazil; 1182.16.5502 Hospital Nossa Senhora da Conceiç, Porto Alegre - Rs, Brazil; 1182.16.5504 Hospital das Clínicas de Porto Alegre, Porto Alegre - Rs, Brazil; 1182.16.5512 Ambulatório de DST/ AIDS - RS, Porto Alegre - Rs, Brazil; 1182.16.5513 Centro de Pesquisa Hospital Evandro Chagras, Rio de Janeiro, Brazil; 1182.16.5509, Rio de Janeiro - Rj, Brazil; 1182.16.5510, Santos - Sp, Brazil; 1182.16.5501 UNIFESP/ Hospital São Paulo- Univers. Federal de São Paulo, São Paulo - Sp, Brazil; 1182.16.5506 Casa da AIDS da FMUSP, São Paulo - Sp, Brazil; 1182.16.5507 Hospital do Servidor Público Estadual de São Paulo, São Paulo - Sp, Brazil; 1182.16.5508, Vila Mariana, Brazil"
NCT03071302,Sao Jose do Rio Preto Medical School,"Visum Eye Center / Immunogenetic laboratory of FAMERP, São José do Rio Preto, Brazil"
NCT00377637,Hoffmann-La Roche,", Rio de Janeiro, Brazil; , São Paulo, Brazil; , Sorocaba, Brazil"
NCT06863272,Merck Sharp & Dohme LLC,"Fundação Faculdade Regional de Medicina de São José do Rio Preto ( Site 0263), São José do Rio Preto, Brazil; IPITEC ( Site 0275), São Paulo, Brazil; IBCC - Instituto Brasileiro de Controle do Câncer ( Site 0269), São Paulo, Brazil"
NCT02326857,National Cancer Institute (NCI),"Instituto Nacional de Cancer (INCA), Rio de Janeiro, Brazil; Instituto do C(SqrRoot) ncer do Estado de S(SqrRoot) o Paulo, São Paulo, Brazil"
NCT05085457,Universidade do Oeste de Santa Catarina,"Hospital Universitário Santa Terezinha, Joaçaba, Brazil"
NCT05325866,Amgen,"Hospital das Clinicas da Ufmg, Belo Horizonte, Brazil; Centro de Oncologia Mackenzie, Curitiba, Brazil; Associacao Hospitalar Moinhos de Vento, Porto Alegre, Brazil; Instituto do Cancer Arnaldo Vieira de Carvalho, São Paulo, Brazil; Beneficencia Portuguesa de Sao Paulo - Bp, São Paulo, Brazil; Oncologia Rede D Or, São Paulo, Brazil; Oncoclinicas Rio de Janeiro S A, Rio de Janeiro, Brazil"
NCT02562456,University of Sao Paulo,"Complexo Educacional Carlos Osmarinho de Lima - Trailer USP, Barueri, Brazil"
NCT00052156,CancerVax Corporation,"INCA (National Cancer Institute), Rio de Janeiro, Brazil; Hospital Sirio Lebanes, São Paulo, Brazil"
NCT06150456,University of Nove de Julho,"Universidade Nove de Julho, São Paulo, Brazil"
NCT01732822,AstraZeneca,"Research Site, Belo Horizonte, Brazil; Research Site, Belo Horizonte, Brazil; Research Site, Belo Horizonte, Brazil; Research Site, Belo Horizonte, Brazil; Research Site, Brasília, Brazil; Research Site, Campinas, Brazil; Research Site, Campinas, Brazil; Research Site, Canoas, Brazil; Research Site, Curitiba, Brazil; Research Site, Curitiba, Brazil; Research Site, Juiz de Fora, Brazil; Research Site, Porto Alegre, Brazil; Research Site, Porto Alegre, Brazil; Research Site, Porto Alegre, Brazil; Research Site, Rio de Janeiro, Brazil; Research Site, Salvador, Brazil; Research Site, Salvador, Brazil; Research Site, Santo André, Brazil; Research Site, São Bernardo do Campo, Brazil; Research Site, São José do Rio Preto, Brazil; Research Site, São José do Rio Preto, Brazil; Research Site, São Paulo, Brazil; Research Site, São Paulo, Brazil; Research Site, Tatuí, Brazil; Research Site, Uberlândia, Brazil"
NCT02953353,University of Sao Paulo,"Clinical Hospital of Ribeirão Preto, Ribeirão Preto, Brazil"
NCT03928145,Hospital de Clinicas de Porto Alegre,"Hospital de Clinicas de Porto Alegre, Porto Alegre, Brazil"
NCT02644239,University of Sao Paulo,"Nagila Raquel Teixeira Damasceno, São Paulo, Brazil"
NCT05574777,Erbe Elektromedizin GmbH,"Hospital das Clínicas da Faculdade de Medicina da Universidade de São Paulo, São Paulo, Brazil"
NCT05805475,Hospital de Clinicas de Porto Alegre,"Hospital de Clínicas de Porto Alegre, Porto Alegre, Brazil"
NCT05879822,Incyte Corporation,"Fundacao Pio Xii Hospital de Cancer de Barretos, Barretos, Brazil; Cionc-Centro Integrado de Oncologia de Curitiba, Curitiba, Brazil; Hospital Erasto Gaertner - Liga Paranaense de Combate Ao Câncer, Curitiba, Brazil; Oncosite - Centro de Pesquisa Clinica E Oncologia, Ijuí, Brazil; Clinica de Neoplasias Litoral Ltda, Itajaí, Brazil; Fundacao Doutor Amaral Carvalho, Jaú, Brazil; Hospital de Cancer de Londrina, Londrina, Brazil; Irmandade Da Santa Casa de Misericordia de Porto Alegre, Porto Alegre, Brazil; Hgb - Hospital Giovanni Battista - Mae de Deus Center, Porto Alegre, Brazil; Hospital Ernesto Dornelles, Porto Alegre, Brazil; Hospital Nossa Senhora Da Conceicao, Porto Alegre, Brazil; Cepho - Centro de Estudos E Pesquisas de Hematologia E Oncologia, Santo André, Brazil; A. C. Camargo Cancer Center, São Paulo, Brazil"
NCT06454045,University of Sao Paulo,"Heart Institute (InCor) / University of São Paulo, São Paulo, Brazil"
NCT04513730,Universidade Metodista de Piracicaba,"Universidade do Estado do Pará, Belém, Brazil"
NCT04236700,Universidade Metropolitana de Santos,"Caio Vinicius Gonçalves Roman Torres, Santos, Brazil; Caio Torres, Santos, Brazil"
NCT02082600,Federal University of São Paulo,"Associação Fundo de Incentivo à Pesquisa, São Paulo, Brazil"
NCT01003392,University of Sao Paulo,"Heart Institute (InCor), Univ. of Sao Paulo Medical School, São Paulo, Brazil"
NCT04165434,University of Sao Paulo General Hospital,"Julia Maria D'Andrea Greve, São Paulo, Brazil"
NCT01668966,Hoffmann-La Roche,"CIP - Centro Internacional de Pesquisa, Goiânia, Brazil; Centro Mineiro de Pesquisa - CMIP, Juiz de Fora, Brazil; Centro de Estudos em Terapias Inovadoras - CETI, Curtiba, Brazil; Hospital Sao Lucas - PUCRS, Porto Alegre, Brazil; Universidade Federal de Sao Paulo - UNIFESP; Reumatologia, São Paulo, Brazil; Centro Paulista de Investigacao Clinica - CEPIC, São Paulo, Brazil"
NCT02229851,Novo Nordisk A/S,"Novo Nordisk Investigational Site, São Paulo, Brazil"
NCT05683639,Hospital de Clinicas de Porto Alegre,"Insemine Human Reproduction Centre, Porto Alegre, Brazil"
NCT00684177,GlaxoSmithKline,"GSK Investigational Site, Curitiba, Brazil; GSK Investigational Site, Curitiba/Paraná, Brazil; GSK Investigational Site, Passo Fundo, Brazil"
NCT01468701,Boehringer Ingelheim,"Hospital Vera Cruz, Belo Horizonte, Brazil; Clinica Procardio Ltda, Blumenau, Brazil; Hospital do Coracao do Brasil, Brasília, Brazil; Instituto de Cardiologia do Distrito Federal, Brasília, Brazil; Hospital Angelina Caron, Campina Grande do Sul, Brazil; Centro Especializado em Cardiol Loema Instituto de Pesq Clin, Campinas, Brazil; HMCP - Hospital e Maternidade Celso Pierro - PUC-Campinas, Campinas, Brazil; Hospital Nossa Senhora de Pompeia, Caxias do Sul, Brazil; Irmandade da Santa Casa de Misericordia de Curitiba, Curitiba, Brazil; Barroso e Sebba Ltda, Goiânia, Brazil; CLINICOR-Clinica de Exames Cardiolog e Ecografias S S LTDA, Maceió, Brazil; Hospital São Vicente de Paulo, Passo Fundo, Brazil; Hospital de Clínicas de Porto Alegre, Porto Alegre, Brazil; Fundacao Universitaria de Cardiologia - Inst de Cardiologia, Porto Alegre, Brazil; Pronto Socorro Cardiológico de Pernambuco Prof. Luiz Tavares, Recife, Brazil; Hospital Copa D'or, Rio de Janeiro, Brazil; Fundacao Pro-Coracao FUNDACOR, Rio de Janeiro, Brazil; Instituto Cardiopulmonar da Bahia LTDA, Salvador, Brazil; Fundacao Bahiana de Cardiologia, Salvador, Brazil; Instituto de Ensino E Pesquisa Do Hospital Da Bahia, Salvador, Brazil; Instituto de Molestias Cardiovasculares - IMC, São José do Rio Preto, Brazil; H.S.J. Beneficência Portuguesa - São Paulo, São Paulo, Brazil; FGM - Clínica Paulista de Doenças Cardiovasculares, São Paulo, Brazil; Hcor - Hospital do Coracao, São Paulo, Brazil; Instituto Dante Pazzanese de Cardiologia, São Paulo, Brazil; Hospital das Clinicas da Faculdade de Medicina - FMUSP, São Paulo, Brazil; Hospital Santa Marcelina, São Paulo, Brazil; Hospital Sao Paulo UNIFESP, São Paulo, Brazil; Instituto de Molestias Cardiovasculares Tatui SP, Tatuí, Brazil; Santa Casa de Votuporanga, Votuporanga, Brazil"
NCT03117231,Federal University of São Paulo,"Daniela Tavares, São Paulo, Brazil"
NCT04048902,University of Sao Paulo General Hospital,"Department of Physical Therapy, Speech and Occupational Therapy of University of São Paulo, São Paulo, Brazil"
NCT00317395,Sanofi,"Sanofi-Aventis Administrative Office, São Paulo, Brazil"
NCT06029439,"Neumora Therapeutics, Inc.","Neumora Investigator Site, Curitiba, Brazil; Neumora Investigator Site, Botafago - Rio de Janeiro, Brazil; Neumora Investigator Site, Porto Alegre, Brazil; Neumora Investigator Site, Santa Cecília, Brazil; Neumora Investigator Site, São Bernardo do Campo, Brazil; Neumora Investigator Site, São José do Rio Preto, Brazil; Neumora Investigator Site, São Paulo, Brazil"
NCT02890212,University of Sao Paulo General Hospital,"Instituto de Psiquiatria - Hcfmusp, São Paulo, Brazil"
NCT05767112,University of Sao Paulo,"School of Physical Education and Sport - USP, São Paulo, Brazil"
NCT05888714,University of Sao Paulo General Hospital,"Instituto de Medicina Física e Reabilitação, Hospital das Clínicas, Faculdade de Medicina da Universidade de São Paulo, São Paulo, Brazil"
NCT05446415,University of Sao Paulo General Hospital,"Hospital das Clinicas da Faculdade de Medicina da USP, São Paulo, Brazil"
NCT04789135,Anhembi Morumbi University,"Distal Nefrologia e Urologia, Jacareí, Brazil"
NCT00412984,Bristol-Myers Squibb,"Local Institution, Salvador, Brazil; Local Institution, Salvador, Brazil; Local Institution, Salvador, Brazil; Local Institution, Salvador, Brazil; Local Institution, Belo Horzonte, Brazil; Local Institution, Belo Horzonte, Brazil; Local Institution, Juiz de Fora, Brazil; Local Institution, Juiz de Fora, Brazil; Local Institution, Uberaba, Brazil; Local Institution, Uberlândia, Brazil; Local Institution, Uberlândia, Brazil; Local Institution, Campina Grande do Sul, Brazil; Local Institution, Campina Grande do Sul, Brazil; Local Institution, Curitiba, Brazil; Local Institution, Curitiba, Brazil; Local Institution, Curitiba, Brazil; Local Institution, Curitiba, Brazil; Local Institution, Londrina, Brazil; Local Institution, Londrina, Brazil; Local Institution, Belém, Brazil; Local Institution, Belém, Brazil; Local Institution, Natal, Brazil; Local Institution, Natal, Brazil; Local Institution, Porte Alegre, Brazil; Local Institution, Porte Alegre, Brazil; Local Institution, Porte Alegre, Brazil; Local Institution, Porte Alegre, Brazil; Local Institution, Porto Alegre, Brazil; Local Institution, Porto Alegre, Brazil; Local Institution, Porto Alegre, Brazil; Local Institution, Porto Alegre, Brazil; Local Institution, Porto Alegre, Brazil; Local Institution, Porto Alegre, Brazil; Local Institution, Porto Alegre, Brazil; Local Institution, Porto Alegre, Brazil; Local Institution, Blumenau, Brazil; Local Institution, Blumenau, Brazil; Local Institution, São José, Brazil; Local Institution, São José, Brazil; Local Institution, Botucatu, Brazil; Local Institution, Botucatu, Brazil; Local Institution, Campinas, Brazil; Local Institution, Campinas, Brazil; Local Institution, Marília, Brazil; Local Institution, Marília, Brazil; Local Institution, Marília, Brazil; Local Institution, Marília, Brazil; Local Institution, Marília, Brazil; Local Institution, San Jose Do Rio Preto, Brazil; Local Institution, San Jose Do Rio Preto, Brazil; Local Institution, Santo André, Brazil; Local Institution, Santo André, Brazil; Local Institution, São José do Rio Preto, Brazil; Local Institution, São José do Rio Preto, Brazil; Local Institution, São José do Rio Preto, Brazil; Local Institution, Rio de Janeiro, Brazil; Local Institution, Rio de Janeiro, Brazil; Local Institution, Rio de Janeiro, Brazil; Local Institution, Rio de Janeiro, Brazil; Local Institution, São Paulo, Brazil; Local Institution, São Paulo, Brazil; Local Institution, São Paulo, Brazil; Local Institution, São Paulo, Brazil; Local Institution, São Paulo, Brazil; Local Institution, São Paulo, Brazil; Local Institution, São Paulo, Brazil; Local Institution, São Paulo, Brazil; Local Institution, São Paulo, Brazil; Local Institution, São Paulo, Brazil; Local Institution, São Paulo, Brazil; Local Institution, São Paulo, Brazil; Local Institution, São Paulo, Brazil; Local Institution, São Paulo, Brazil; Local Institution, São Paulo, Brazil"
NCT03400033,GlaxoSmithKline,"GSK Investigational Site, Salvador, Brazil; GSK Investigational Site, Curitiba, Brazil; GSK Investigational Site, Passo Fundo, Brazil; GSK Investigational Site, Porto Alegre, Brazil; GSK Investigational Site, São José do Rio Preto, Brazil; GSK Investigational Site, Belo Horizonte, Minas Gerais, Brazil; GSK Investigational Site, São Paulo, Brazil"
NCT01950026,Paulista University,"Rehabilitation Center of Universidade Paulista, São Paulo, Brazil"
NCT03424278,University of Brasilia,"University of Brasilia, Brasília, Brazil"
NCT02939625,University of Nove de Julho,"Maisi David Cabral, São Paulo, Brazil"
NCT03160976,Federal University of Health Science of Porto Alegre,"Federal University of Health Science of Porto Alegre, Porto Alegre, Brazil"
NCT00635947,UPECLIN HC FM Botucatu Unesp,"School of Medicine of Botucatu--São Paulo State University (Unesp)--, Botucatu, Brazil"
NCT01071785,Hospital de Clinicas de Porto Alegre,"HCPA, Porto Alegre, Brazil"
NCT03235284,Federal University of Bahia,"Complex Hospital Professor Edgard Santos, Federal University of Bahia, Salvador, Brazil"
NCT00565838,UPECLIN HC FM Botucatu Unesp,"Medical School of Medicine, Botucatu, Brazil"
NCT00261443,"Otsuka Pharmaceutical Development & Commercialization, Inc.","Local Institution, Salvador, Brazil; Local Institution, Aparecida de Goinia, Brazil; Local Institution, Pelotas, Brazil; Local Institution, Rio de Janeiro, Brazil; Local Institution, São Paulo, Brazil; Local Institution, São Paulo, Brazil"
NCT02105376,Santa Casa Medical School,"Centro de Atencao Integrada à Saúde Mental, São Paulo, Brazil"
NCT04681040,"National Center for Global Health and Medicine, Japan","Hospital das Clinicas Ribeirao Preto, Ribeirão Preto, Brazil"
NCT01392638,"University of Campinas, Brazil","Laboratory of Cardiovascular Pharmacology - FCM - Unicamp, Campinas, Brazil"
NCT05310526,Hospital do Coracao,"Prefeitura Municipal de Foz do Iguaçu, Foz do Iguaçu, Brazil"
NCT04304326,Federal University of São Paulo,"São Paulo Hospital, São Paulo, Brazil"
NCT03923608,São Paulo State University,"State University of são Paulo, Presidente Prudente, Brazil"
NCT05696925,Federal University of Health Science of Porto Alegre,"UFCSPA, Porto Alegre, Brazil"
NCT06937099,Eli Lilly and Company,"NewData Clinical Research - Aracaju, Aracaju, Brazil; L2IP - Instituto de Pesquisas Clínicas, Brasília, Brazil; Loema Instituto de Pesquisa Clinica, Campinas, Brazil; Fundação Universidade de Caxias do Sul (FUCS), Caxias do Sul, Brazil; Centro Digestivo de Curitiba, Curitiba, Brazil; Galileo Medical Research, Juiz de Fora, Brazil; Hospital de Clinicas de Porto Alegre, Porto Alegre, Brazil; Hospital de Clínicas de Ribeirão Preto, Ribeirão Preto, Brazil; CLIAGEN Clínica de Atenção em Gastroenterologia, Especialidades e Nutrição, Salvador, Brazil; Pesquisare Saude, Santo André, Brazil; CPQuali Pesquisa Clínica, São Paulo, Brazil; CEPIC - Centro Paulista de Investigação Clínica, São Paulo, Brazil; Clínica Hepatogastro JK, São Paulo, Brazil; CEDOES, Vitória, Brazil; Integral Pesquisa e Ensino, Votuporanga, Brazil"
NCT01802268,Helio Tedesco Silva Junior,"Hospital University Evangélico de Curitiba, Curitiba, Parana, Brazil, Curitiba, Brazil; Nephrology Service, Bonsucesso General Hospital. Rio de Janeiro, Brazil, Rio de Janeiro, Brazil; Kidney & Pancreas Transplant Unit, Santa Casa de Misericordia, Porto Alegre, Brazil, Porto Alegre, Brazil; Instituto de Urologia e Nefrologia & Medical School-FAMERP/HB-FUNFARME, São José do Rio Preto-SP, Brazil, São Jose Do Rio Preto, Brazil; Nephrology Division, Hospital do Rim, Federal University of São Paulo, Brazil, São Paulo, Brazil; Renal Transplant Service, Hospital das Clínicas, University of São Paulo School of Medicine, São Paulo, Brazil., São Paulo, Brazil"
NCT04467476,Universidade Federal do Piauí,"Department of Physical Therapy. Federal University of Piaui, Parnaíba, Brazil"
NCT00289640,Bristol-Myers Squibb,"Local Institution, Centro-Porto Alegre, Brazil; Local Institution, Porto Alegre, Brazil; Local Institution, Jaú, Brazil; Local Institution, São Paulo, Brazil"
NCT02105740,Gil Montenegro,"UNB- Universidade de Brasilia, Brasília, Brazil"
NCT02459444,Federal University of Bahia,"Mansueto Gomes Neto, Salvador, Brazil"
NCT06619509,Boehringer Ingelheim,"H.S.J. Beneficência Portuguesa - São Paulo, São Paulo, Brazil"
NCT06651099,University of Brasilia,"Universidade de Brasília, Ceilândia, Brazil; Federal University of Mato Grosso do Sul, Campo Grande, Brazil"
NCT02327052,Hospital Sao Rafael,"Hospital São Rafael, Salvador, Brazil"
NCT02420821,Hoffmann-La Roche,"Hospital de Caridade de Ijui; Oncologia, Ijuí, Brazil; Santa Casa de Misericordia de Porto Alegre, Porto Alegre, Brazil; Hospital Sao Lucas - PUCRS, Porto Alegre, Brazil; Instituto do Cancer do Estado de Sao Paulo - ICESP, São Paulo, Brazil"
NCT02761187,Takeda,"Unicamp Universidade Estadual de Campinas, Campinas, Brazil; Centro de Pesquisas Oncologicas, Florianópolis, Brazil; Hospital Das Clinicas Da Universidade Federal de Goias, Goiânia, Brazil; Universidade Federal Do Rio de Janeiro Hospital Universitario Clementino Fraga Filho, Rio de Janeiro, Brazil; CEHON - Centro de Hematologia e Oncologia da Bahia Ltda, Salvador, Brazil; Clinica Sao Germano, São Paulo, Brazil; Hospital Israelita Albert Einstein, São Paulo, Brazil; Hospital das Clinicas da Faculdade de Medicina da Universidade de Sao Paulo, São Paulo, Brazil"
NCT03103204,University of Taubate,"University of Taubate, Taubaté, Brazil"
NCT01110252,UPECLIN HC FM Botucatu Unesp,"Laboratório de Genética Humana e Terapia Celular, Assis, Brazil"
NCT05772338,EMS,"EMS, Hortolândia, Brazil; Cecip Jau - Centro de Estudos Clinicos Do Interior Paulista Ltda, Jaú, Brazil"
NCT03712215,Universidade Metodista de Piracicaba,"Hospital de Clínicas Gaspar Viana, Belém, Brazil"
