NCTId,Sponsor,Locations
NCT01420549,Ache Laboratorios Farmaceuticos S.A.,"Centro de Pesquisas em Diabetes e Doenças Endócrino-Metabólicas- UFC, Fortaleza, Brazil; Centro de Pesquisas Médicas Básica e Clínica, Recife, Brazil; CCBR Brasil Centro de Pesquisas e Análises Clínicas, Rio de Janeiro, Brazil; CEPIC Centro Paulista de Investigação Clínica, São Paulo, Brazil; FGM - Clínica Paulista de Doenças Cardiovasculares, São Paulo, Brazil; Hospital do Rim e Hipertensão, São Paulo, Brazil; Universidade Federal de São Paulo, São Paulo, Brazil"
NCT02472158,University of Sao Paulo,"Clinical Hospital of Ribeirão Preto Medical School (HCFMRP-USP), Ribeirão Preto, Brazil"
NCT03095378,University of Sao Paulo,"Bauru School of Dentistry, Bauru, Brazil"
NCT00668889,Sanofi,"Sanofi-aventis administrative office, São Paulo, Brazil"
NCT03760497,University of Sao Paulo,"School of Dentistry of Ribeirao Preto, Ribeirão Preto, Brazil"
NCT06005259,University of Sao Paulo,"Instituto do Coração, São Paulo, Brazil"
NCT01903733,Pfizer,"Universidade Estadual de Campinas / Centro de Hematologia e Hemoterapia, Campinas, Brazil; Faculdade de Medicina do ABC - Centro de Estudos e Pesquisa em Hematologia e Oncologia (CEPHO), Santo André, Brazil"
NCT00999648,University of Sao Paulo General Hospital,"Clinics Hospital of University of Sao Paulo Medical School - Department of Otorhinolaryngology, São Paulo, Brazil"
NCT02772185,Federal University of Paraíba,"Suellen Andrade, João Pessoa, Brazil"
NCT02066935,Fundação Instituto Mineiro de Estudo Pesquisa Em Nefrologi,"Fundação Instituto Mineiro de Estudos e Pesquisas em Nefrologia, Juiz de Fora, Brazil"
NCT05558397,Universidade Federal de Alfenas,"Larissa Helena Lobo Torres Pacheco, Alfenas, Brazil"
NCT01549678,Federal University of São Paulo,"Federal University of Sao Paulo, São Paulo, Brazil"
NCT05946915,Faculdade de Ciências Médicas da Santa Casa de São Paulo,"Santa Casa SP School of Medical Sciences, São Paulo, Brazil"
NCT01007435,Hoffmann-La Roche,"Centro Internacional de Pesquisa; Reumatologia, Goiânia, Brazil; Hospital das Clinicas - UFG;Reumatologia, Goiânia, Brazil; Centro Mineiro de Pesquisa - CMIP, Juiz de Fora, Brazil; Centro de Estudos em Terapias Inovadoras - CETI, Curtiba, Brazil; Hospital Sao Lucas - PUCRS, Porto Alegre, Brazil; Hospital e Maternidade Celso Pierro - PUCCamp; Reumatologia, Campinas, Brazil; Universidade Federal de Sao Paulo - UNIFESP; Reumatologia, São Paulo, Brazil; Centro Paulista de Investigacao Clinica - CEPIC, São Paulo, Brazil"
NCT05232825,Hoffmann-La Roche,"CEDOES - Diagnóstico e Pesquisa, Vitória, Brazil; Clinica Amo - Assistencia Medica Em Oncologia, Salvador, Brazil"
NCT03524768,"National Institute of Cardiology, Laranjeiras, Brazil","National Institute of Cardiology, Ministry of Health, Brazil, Rio de Janeiro, Brazil"
NCT05573568,Biomind Labs Inc.,"Hospital Universitário Onofre Lopes, Natal, Brazil"
NCT03338790,Bristol-Myers Squibb,"Local Institution - 0020, Belo Horizonte, Brazil; Local Institution - 0074, Belo Horizonte, Brazil; Local Institution - 0075, Curitiba, Brazil; Local Institution - 0018, Ijuí, Brazil; Local Institution - 0021, Porto Alegre, Brazil; Local Institution - 0022, Campinas, Brazil; Local Institution - 0071, São Paulo, Brazil; Local Institution - 0019, Rio de Janeiro, Brazil; Local Institution - 0073, São Paulo, Brazil"
NCT06646523,Federal University of Minas Gerais,"Federal University of Minas Gerais, Belo Horizonte, Brazil"
NCT01333852,Lucas Vieira dos Santos,"Barretos Cancer Hospital, Barretos, Brazil"
NCT05492578,Sanofi,"Instituto Bahiano de Imunoterapia - IBIS- Site Number : 0760002, Salvador, Brazil; Irmandade da Santa Casa de Misericordia de Porto Alegre- Site Number : 0760005, Porto Alegre, Brazil; FUNDACAO DO ABC - FACULDADE DE MEDICINA DO ABC (FMABC)- Site Number : 0760001, Santo André, Brazil; CDEC Brasil - Centro de Desenvolvimento em Estudos Clinicos Brasil- Site Number : 0760014, São Paulo, Brazil; Clinica de Alergia Martti Antila- Site Number : 0760006, Sorocaba, Brazil; Hospital Alemao Oswaldo Cruz - São Paulo- Site Number : 0760010, São Paulo, Brazil"
NCT01228643,Azidus Brasil,"LAL Clinica Pesquisa e Desenvolvimento LTDA, Valinhos, Brazil"
NCT01294943,University of Sao Paulo,"Hospital Santa Cruz, São Paulo, Brazil"
NCT05843643,AbbVie,"CEDOES - Centro de Diagnóstico e Pesquisa da Osteoporose do Espírito Santo /ID# 254588, Vitória, Brazil; SER - Servicos Especializados em Reumatologia da Bahia /ID# 253354, Salvador, Brazil; CMiP - Centro Mineiro de Pesquisa Ltda - ME /ID# 253346, Juiz de Fora, Brazil; EDUMED Educacao em Saude S/S LTDA /ID# 253274, Curitiba, Brazil; Hospital de Clinicas de Porto Alegre /ID# 253357, Porto Alegre, Brazil; LMK Sevicos Medicos S/S /ID# 253353, Porto Alegre, Brazil; Fundacao Faculdade Regional de Medicina de Sao Jose do Rio Preto /ID# 261024, São José do Rio Preto, Brazil; Hospital do Rim /ID# 253983, São Paulo, Brazil; Hospital das Clinicas da Faculdade de Medicina da Universidade de Sao /ID# 254316, São Paulo, Brazil"
NCT01788176,University of Sao Paulo General Hospital,"Centro de Pesquisa Clínica do Instituto de Medicina e Reabilitação do HCFMUSP, São Paulo, Brazil"
NCT06023589,AstraZeneca,"Research Site, Blumenau, Brazil; Research Site, Curitiba, Brazil; Research Site, Salvador, Brazil; Research Site, São Paulo, Brazil; Research Site, São Paulo, Brazil; Research Site, São Paulo, Brazil; Research Site, Sorocaba, Brazil"
NCT03034447,Federal University of São Paulo,"Federal University of São Paulo, São Paulo, Brazil"
NCT01385384,University of Sao Paulo,"Heart Institute (InCor) Hospital das Clinicas da Faculdade de Medicina da Universidade de Sao Paulo, São Paulo, Brazil; Hospital das Clinicas da Faculdade de Medicina da Universidade de Sao Paulo, São Paulo, Brazil"
NCT03469778,University of Sao Paulo General Hospital,"Centro de Pesquisa Clínica - Instituto de Medicina Física e Reabilitação, São Paulo, Brazil"
NCT04126785,Universidade Estadual Paulista Júlio de Mesquita Filho,"São Paulo State Univeristy, Bauru, Brazil"
NCT00519285,Sanofi,"Sanofi-Aventis Administrative Office, São Paulo, Brazil"
NCT05821725,Colgate Palmolive,"Faveri Academy, Guarulhos, Brazil"
NCT00842140,University of Sao Paulo,"University of Sao Paulo, Ribeirão Preto, Brazil"
NCT00942097,Edgard Costa de Vilhena,"Amparo Maternal Maternidade Social, São Paulo, Brazil"
NCT03526133,University of Sao Paulo General Hospital,"Incor - Heart Institute, Sleep Laboratory, São Paulo, Brazil"
NCT00925158,Federal University of São Paulo,"Hospital São Paulo - UNIFESP, São Paulo, Brazil"
NCT04453085,"JCR Pharmaceuticals Co., Ltd.","Hospital de Clínicas de Porto Alegre, Porto Alegre, Brazil; Instituto de Genética e Erros Inatos do Metabolismo - IGEIM, São Paulo, Brazil"
NCT03090685,Universidade Federal do Ceara,"Grupo de Atenção Integral e Pesquisa em Acupuntura e Medicina Tradicional Chinesa - GAIPA, Fortaleza, Brazil"
NCT06472076,GlaxoSmithKline,"GSK Investigational Site, Barretos, Brazil; GSK Investigational Site, Belém, Brazil; GSK Investigational Site, CuritibaPR, Brazil; GSK Investigational Site, Florianópolis, Brazil; GSK Investigational Site, Fortaleza, Brazil; GSK Investigational Site, Londrina, Brazil; GSK Investigational Site, Porto VelhoRondOnia, Brazil; GSK Investigational Site, Salvador, Brazil; GSK Investigational Site, SAo JosE Do Rio PretoSP, Brazil; GSK Investigational Site, São Paulo, Brazil; GSK Investigational Site, Vitória, Brazil"
NCT02179320,University of Sao Paulo General Hospital,"Hospital das Clínicas da Faculdade de Medicina da Universidade de São Paulo, São Paulo, Brazil"
NCT03777852,University of Sao Paulo,"Hospital das Clínicas de Ribeirão Preto, Ribeirão Preto, Brazil"
NCT01481558,University of Sao Paulo,"University of São Paulo Medical School, São Paulo, Brazil"
NCT04410250,Federal University of the Valleys of Jequitinhonha and Mucuri,"Ana Beatriz Silva Lopes, Diamantina, Brazil"
NCT04100018,Bristol-Myers Squibb,"Local Institution - 0097, Belo Horizonte, Brazil; Local Institution - 0022, Belo Horizonte, Brazil; Local Institution - 0100, Curitiba, Brazil; Local Institution - 0082, Curitiba, Brazil; Local Institution - 0321, Natal, Brazil; Local Institution - 0058, Ijuí, Brazil; Local Institution - 0063, Porto Alegre, Brazil; Local Institution - 0056, Porto Alegre, Brazil; Local Institution - 0057, Porto Alegre, Brazil; Local Institution - 0086, Campinas, Brazil; Local Institution - 0059, Santo André, Brazil; Local Institution - 0096, São José do Rio Preto, Brazil; Local Institution - 0189, Rio de Janeiro, Brazil; Local Institution - 0060, Rio de Janeiro, Brazil; Local Institution - 0080, São Paulo, Brazil; Local Institution - 0273, São Paulo, Brazil; Local Institution - 0328, São Paulo, Brazil"
NCT01816360,University of Sao Paulo,"Universidade de São Paulo, São Paulo, Brazil"
NCT06536348,Federal University of Uberlandia,"Laboratório de Análise de Movimento e Processamento de Sinais, Brasília, Brazil; Centro Universitário Araguaia (UniAraguaia), Goiânia, Brazil; Associação Parkinson Goiás, Goiânia, Brazil; Ambulatório de Doença de Parkinson e Distúrbios do Movimento do Hospital de Clínicas de Uberlândia, Uberlândia, Brazil; Núcleo de Inovação e Avaliação Tecnológica em Saúde / Centre for Innovation and Technology Assessment in Health, Uberlândia, Brazil"
NCT02860078,University of Sao Paulo General Hospital,"Shirley Andrade Santos, São Paulo, Brazil"
NCT01570218,Universidade Federal de Goias,"Goias Anticancer Association, Goiânia, Brazil; Hospital Araujo Jorge, Associacao de Combate ao Cancer em Goias, Goiânia, Brazil"
NCT02848274,Stanford University,"University of Sao Paulo Medical School, São Paulo, Brazil"
NCT05493410,University Vila Velha,"Maurício Bona Gracelli, Vila Velha, Brazil; Maurício Bona Gracelli, Vitória, Brazil"
NCT02401958,Federal University of São Paulo,"Federal University of Sao Paulo, São Paulo, Brazil"
NCT06191315,Sanofi,"Inst de Medicina Integral Professor Fernando Figueira- Site Number : 0760006, Recife, Brazil; Hospital Ernesto Dornelles Site Number : 0760004, Porto Alegre, Brazil; Hospital Ernesto Dornelles- Site Number : 0760004, Porto Alegre, Brazil; Clinica de Alergia Martti Antila- Site Number : 0760002, Sorocaba, Brazil; Hospital das Clinicas FMUSP- Site Number : 0760001, São Paulo, Brazil"
NCT01719276,University of Sao Paulo,"Medicine School of the University Of São Paulo, São Paulo, Brazil"
NCT00106574,Hoffmann-La Roche,", Campinas, Brazil; , Goiânia, Brazil; , Rio de Janeiro, Brazil"
NCT04662918,Xingshun Qi,"São Paulo State University (UNESP), Botucatu Medical School, São Paulo, Brazil"
NCT01408849,Casa Espirita Terra de Ismael,"Hospital das Clinicas FMRP-USP, Ribeirão Preto, Brazil"
NCT02656238,International CTEPH Association,"Hospital São Paulo, Federal University of São Paulo, São Paulo, Brazil; University of Sao Paulo Medical School, São Paulo, Brazil"
NCT03263260,Scitech Produtos Medicos Ltda,"União Brasileira de Educação e Assistência - Hospital São Lucas da PUC - RS, Porto Alegre, Brazil"
NCT01053780,Universidade do Extremo Sul Catarinense - Unidade Academica de Ciecias da Saude,"Maria Inês da Rosa, Criciúma, Brazil; Universidade do Extremo Sul Catarinense, Criciúma, Brazil"
NCT04072341,University of Sao Paulo General Hospital,"Marcelo Augusto Duarte Silveira, Salvador, Brazil"
NCT06169241,"National Institute of Cardiology, Laranjeiras, Brazil","National Institute of Cardiology, Rio de Janeiro, Brazil"
NCT06174805,Boston Scientific Corporation,"Instituto do Cancer do Estado de Sao Paulo, São Paulo, Brazil"
NCT04985968,InDex Pharmaceuticals,"Instituto Goiano de Gastroenterologia e Endoscopia Digestiva Ltda, Goiânia, Brazil; Hospital de Clinicas de Porto Alegre - Centro de Pesquisa Clinica, Porto Alegre, Brazil; Ufrj - Hospital Universitario Clementino Fraga Filho, Rio de Janeiro, Brazil; Praxis Pesquisa Medica, Santo André, Brazil; CEMEC - Centro Multidisciplinar de Estudos Clinicos, São Bernardo do Campo, Brazil; Kaiser Clinica, São José do Rio Preto, Brazil"
NCT03637946,Federal University of Minas Gerais,"Federal University Of Minas Gerais, Belo Horizonte, Brazil"
NCT07066046,Instituto do Cancer do Estado de São Paulo,"Hospital das Clínicas da Faculdade de Medicina da USP, São Paulo, Brazil"
NCT06424288,Boehringer Ingelheim,"Hospital Vera Cruz, Belo Horizonte, Brazil; Cardresearch Cardiologia Assistencial e de Pesquisas Ltda, Belo Horizonte, Brazil; L2IP -Instituto de Pesquisas Clínicas Ltda., Brasília, Brazil; CECAP - Centro de Cardiologia Clínica, Brasília, Brazil; Hospital Angelina Caron, Campina Grande do Sul, Brazil; IPECC - Instituto de Pesquisa Clínica de Campinas, Campinas, Brazil; Centro Especializado em Cardiol Loema Instituto de Pesq Clin, Campinas, Brazil; Hospital do Rocio, Campo Largo, Brazil; PUC Trials - Núcleo de Pesquisa Clínica da Escola de Medicina da PUC-PR, Curitiba, Brazil; Via Medica, Goiânia, Brazil; ICM - Instituto do Coracao de Marilia, Marília, Brazil; Instituto Mederi de Pesquisa e Saude, Passo Fundo, Brazil; Santa Casa de Misericórdia de Porto Alegre, Porto Alegre, Brazil; Hospital de Clínicas de Porto Alegre, Porto Alegre, Brazil; Universidade Federal do Rio Grande do Sul, Porto Alegre, Brazil; Hospital Mae de Deus, Porto Alegre, Brazil; Hospital das Clínicas FMRP-USP, Ribeirão Preto, Brazil; Instituto Brasil de Pesquisa Clinica (IBPClin), Rio de Janeiro, Brazil; Ruschel Medicina e Pesquisa Clínica, Rio Do Janeiro, Brazil; Pesquisare, Santo André, Brazil; Praxis Pesquisa Medica, Santo André, Brazil; Fundacao Faculdade Regional de Medicina, Sao Jose, Sao Jose Rio Preto, Brazil; Centro de Pesquisa Clinica - CPCLIN, São Paulo, Brazil; CEPIC - Centro Paulista de Investigacao Clinica, São Paulo, Brazil; CEDOES - Diagnóstico e Pesquisa,Vitória, Vitória, Brazil; Integral Pesquisa e Ensino, Votuporanga, Brazil"
NCT05267483,D'Or Institute for Research and Education,"D'Or Institute for Research and Education (IDOR), Rio de Janeiro, Brazil"
NCT02414854,Sanofi,"Investigational Site Number 076009, Florianópolis, Brazil; Investigational Site Number 076007, Porto Alegre, Brazil; Investigational Site Number 076001, Porto Alegre, Brazil; Investigational Site Number 076003, Salvador, Brazil; Investigational Site Number 076013, São Bernardo do Campo, Brazil; Investigational Site Number 076012, São Paulo, Brazil; Investigational Site Number 076008, São Paulo, Brazil; Investigational Site Number 076006, São Paulo, Brazil; Investigational Site Number 076002, Sorocaba, Brazil"
NCT06388889,Areteia Therapeutics,"Research Site 20055-007, Blumenau, Brazil; Research Site 20055-004, Porto Alegre, Brazil; Research Site 20055-010, Porto Alegre, Brazil; Research Site 20055-001, São Bernardo, Brazil; Research Site 20055-003, São Paulo, Brazil; Research Site 20055-008, São Paulo, Brazil; Research Site 20055-002, Sorocaba, Brazil"
NCT02456220,Bernardo Quiroga Souki,"Pontifícia Universidade Católica de Minas Gerais, Belo Horizonte, Brazil"
NCT01515423,"Janssen Research & Development, LLC",", Rio de Janeiro, Brazil"
NCT00125970,National Institute of Allergy and Infectious Diseases (NIAID),"Projeto Praca Onze/Hesfa Crs, Rio de Janeiro, Brazil; Sao Paulo HVTU - CRT DST/AIDS CRS, São Paulo, Brazil"
NCT04456673,Sanofi,"CEDOES - Centro de Diagnostico e Pesquisa de Osteoporose do ES Site Number : 0760020, Vitória, Brazil; SER da Bahia Site Number : 0760019, Salvador, Brazil; Instituto Mederi de Pesquisa e Saude Site Number : 0760008, Passo Fundo, Brazil; Irmandade da Santa Casa de Misericordia de Porto Alegre Site Number : 0760017, Porto Alegre, Brazil; Hospital Sao Lucas Site Number : 0760001, Porto Alegre, Brazil; HOSPITAL DIA DO PULMAO Site Number : 0760006, Blumenau, Brazil; UFSC - Hospital Universitário Site Number : 0760018, Florianópolis, Brazil; PUC Campinas - Sociedade Campineira de Educaçao e Instruçao Site Number : 0760015, Campinas, Brazil; FUNDACAO DO ABC - FACULDADE DE MEDICINA DO ABC (FMABC) Site Number : 0760007, Santo André, Brazil; CPQuali Pesquisa Clinica Site Number : 0760003, São Paulo, Brazil; Instituto de Pesquisa Grupo NotreDame Intermedica Site Number : 0760012, São Paulo, Brazil; Nucleo de Pesquisa Clinica e Ensino da Rede Sao Camilo Site Number : 0760021, São Paulo, Brazil; InCor - Instituto do Coraçao do Hospital das Clinicas da FMUSP Site Number : 0760002, São Paulo, Brazil; Clinica de Alergia Martti Antila Site Number : 0760009, Sorocaba, Brazil"
NCT02369341,GlaxoSmithKline,"GSK Investigational Site, Belo Horizonte, Brazil; GSK Investigational Site, São Paulo, Brazil"
NCT04967794,University of Sao Paulo,"Marilia G Gomes, Ribeirão Preto, Brazil"
NCT03931525,Quiropraxia y Equilibrio,"Universidade Potiguar, Natal, Brazil"
NCT03094676,Universidade Estadual Paulista Júlio de Mesquita Filho,"Nilton Mantovani Junior, Presidente Prudente, Brazil"
NCT06976203,Bristol-Myers Squibb,"Local Institution - 0115, Fortaleza, Brazil; Local Institution - 0101, Maringá, Brazil; Local Institution - 0099, Rio de Janeiro, Brazil; Local Institution - 0100, São Paulo, Brazil"
NCT02578160,Evelyn Alvarez Vidigal,"Faculdade de Odontologia da Universidade de Sao Paulo, São Paulo, Brazil"
NCT03089723,University of Sao Paulo General Hospital,"Instituto de Ortopedia e Traumatologia, São Paulo, Brazil"
NCT00474123,University of Sao Paulo,"Heart Institute (InCor) HOSPITAL DAS CLINICAS DA FACULDADE DE MEDICINA DA UNIVERSIDADE DE SAO PAULO (HCFMUSP), São Paulo, Brazil"
NCT01946269,University of Sao Paulo,"Intensive Care Unit of the Cancer Institute of Sao Paulo State, São Paulo, Brazil"
NCT03092141,University of Sao Paulo,"Samuel Katsuyuki Shinjo, São Paulo, Brazil"
NCT00961805,Federal University of São Paulo,"Federal University of Sao Paulo, São Paulo, Brazil"
NCT04554823,Hospital Israelita Albert Einstein,"Hospital Municipal Vila Santa Catarina, São Paulo, Brazil"
NCT03467282,Hospital de Clinicas de Porto Alegre,"Hospital de Clinicas de Porto Alegre, Porto Alegre, Brazil"
NCT01301924,Oswaldo Cruz Foundation,"Oswaldo Cruz Foundation - IPEC/FIOCRUZ, Rio de Janeiro, Brazil"
NCT04281446,University of Sao Paulo,"Rinaldo Roberto de Jesus Guirro, Ribeirão Preto, Brazil; Universidade de São Paulo, Ribeirão Preto, Brazil"
NCT01358266,Santen Inc.,", Americana, Brazil; , Araraquara, Brazil; , Londrina, Brazil; , Recife, Brazil; , Rio de Janeiro, Brazil; , São Paulo, Brazil; , Sorocaba, Brazil"
NCT02610842,"University of Campinas, Brazil","Clinical Hospital of University of Campinas, Campinas, Brazil; University of Campinas, Campinas, Brazil"
NCT01487083,Eli Lilly and Company,"For additional information regarding investigative sites for this trial, contact 1-877-CTLILLY (1-877-285-4559, 1-317-615-4559) Mon - Fri from 9 AM to 5 PM Eastern Time (UTC/GMT - 5 hours, EST), or speak with your personal physician., Salvador, Brazil; For additional information regarding investigative sites for this trial, contact 1-877-CTLILLY (1-877-285-4559, 1-317-615-4559) Mon - Fri from 9 AM to 5 PM Eastern Time (UTC/GMT - 5 hours, EST), or speak with your personal physician., São Paulo, Brazil"
NCT00644605,Pfizer's Upjohn has merged with Mylan to form Viatris Inc.,"Pfizer Investigational Site, São Paulo, Brazil"
NCT02276794,Federal University of Health Science of Porto Alegre,"Federal University of Health Sciences of Porto Alegre, Porto Alegre, Brazil"
NCT04248894,University of Sao Paulo General Hospital,"Heart Institute, São Paulo, Brazil; Heart Institute (InCor), São Paulo, Brazil"
NCT02293382,"Alexion Pharmaceuticals, Inc.",", Porte Alegre, Brazil"
NCT04166188,University of Sao Paulo General Hospital,"Faculdade de Medicina da Universidade de São Paulo, São Paulo, Brazil"
NCT03403088,University of Sao Paulo,"University of Sao Paulo -Ribeirao Preto Campus, Ribeirão Preto, Brazil"
NCT05356403,"Cara Therapeutics, Inc.","Cara Therapeutics Study Site, Belo Horizonte, Brazil; Cara Therapeutics Study Site, Joinville, Brazil; Cara Therapeutics Study Site, Salvador, Brazil; Cara Therapeutics Study Site, São Bernardo do Campo, Brazil; Cara Therapeutics Study Site, São José do Rio Preto, Brazil; Cara Therapeutics Study Site, São Paulo, Brazil; Cara Therapeutics Study Site 2, São Paulo, Brazil; Cara Therapeutics Study Site, São Paulo, Brazil"
NCT03359070,Galeno Desenvolvimento de Pesquisas Clínicas,"Galeno Desenvolvimento de Pesquisas Clinicas Ltda. - ME, Campinas, Brazil"
NCT06226883,"Morphic Therapeutic, Inc. (A Wholly Owned Subsidiary of Eli Lilly and Company)","Chronos Pesquisa Clínica, Brasília, Brazil; Pesquisare, Santo André, Brazil; Pesquisare, Santo André, Brazil; Clínica Hepatogastro JK, São Paulo, Brazil"
NCT03337724,Hoffmann-La Roche,"Santa Casa de Misericordia de Salvador, Salvador, Brazil; Hospital Araujo Jorge; Departamento de Ginecologia E Mama, Goiânia, Brazil; Hospital do Câncer de Londrina, Londrina, Brazil; Instituto Nacional de Cancer - INCa; Oncologia, Rio de Janeiro, Brazil; Hospital Sao Lucas - PUCRS, Porto Alegre, Brazil; Hospital Nossa Senhora da Conceicao, Porto Alegre, Brazil; Faculdade de Medicina do ABC - FMABC, Santo André, Brazil; Hospital Perola Byington, São Paulo, Brazil"
NCT04869527,Biotronik SE & Co. KG,"Santa Casa de Misericórdia de Porto Alegre - Brugada Institute, Porto Alegre, Brazil; BIOTRONIK Coml Médica LTDA, São Paulo, Brazil"
NCT03785769,Universidade Ibirapuera,"Tamara Kerber Tedesco, São Paulo, Brazil"
NCT01833416,Helio Tedesco Silva Junior,"Hospital do Rim e Hipertensao, São Paulo, Brazil"
NCT04575558,Latin American Cooperative Oncology Group,"Núcleo de Oncologia da Bahia - NOB, Salvador, Brazil; Oncoclínicas BH, Belo Horizonte, Brazil; Centro Oncológico do Triângulo - COT, Uberlândia, Brazil; Multihemo, Recife, Brazil; Oncoclinicas RJ, Rio de Janeiro, Brazil; Centro de Pesquisa em Oncologia PUCRS, Porto Alegre, Brazil; Centro Paulista de Oncologia, São Paulo, Brazil"
NCT02589548,Universidade Federal do Rio de Janeiro,"Universidade Federal Do Rio de Janeiro, Rio de Janeiro, Brazil"
NCT02194985,Amicus Therapeutics,"Clinical Study Site, Porto Alegre, Brazil"
NCT02200614,Bayer,", Fortaleza, Brazil; , Salvador, Brazil; , Goiânia, Brazil; , Belo Horizonte, Brazil; , Juiz de Fora, Brazil; , Uberlândia, Brazil; , Curitiba, Brazil; , Recife, Brazil; , Passo Fundo, Brazil; , Porto Alegre, Brazil; , Porto Alegre, Brazil; , Itajaí, Brazil; , Barretos, Brazil; , Jaú, Brazil; , Ribeirao Preto - SP, Brazil; , São Paulo, Brazil; , São Paulo, Brazil; , São Paulo, Brazil; , São Paulo, Brazil; , São Paulo, Brazil; , Sorocaba, Brazil"
NCT03691285,Universidade Federal de Goias,"School of Dentistry, Federal University of Goias, Goiânia, Brazil"
NCT04072835,Milestone Pharmaceuticals Inc.,"5221, Belo Horizonte, Brazil; 5217, Brasília, Brazil; 5215, Campinas, Brazil; 5222, Canoas, Brazil; 5207, Curitiba, Brazil; 5227, Juiz de Fora, Brazil; 5209, Recife, Brazil; 5214, Salvador, Brazil; 5219, Santo André, Brazil; 5212, São José do Rio Preto, Brazil; 5220, São Paulo, Brazil; 5225, São Paulo, Brazil; 5205, Uberlândia, Brazil; 5228, Belo Horizonte, Brazil; 5202, Campinas, Brazil; 5201, Goiânia, Brazil; 5229, Jaú, Brazil; 5235, Rio de Janeiro, Brazil; 5232, São Paulo, Brazil; 5204, Tatuí, Brazil; 5231, Votuporanga, Brazil"
NCT02254408,Gilead Sciences,"Hospital de Clínicas de Porto Alegre, Porto Alegre, Brazil; Fundacao Faculdade Regional Medicina de Sao Jose do Rio Preto, São Paulo, Brazil; Fundação Antonio Prudente - Hospital do Câncer AC Camargo, São Paulo, Brazil; Hospital Israelita Albert Einstein, São Paulo, Brazil; Hospital Santa Marcelina, São Paulo, Brazil; Hospital Universitario USP, São Paulo, Brazil; Instituto Brasileiro de Controle do Câncer-IBCC, São Paulo, Brazil"
NCT03183752,Hospital Universitário Clementino Fraga Filho,"Patricia Santos, Rio de Janeiro, Brazil"
NCT01121835,Sanofi,"Investigational Site Number 076002, Belém, Brazil; Investigational Site Number 076005, Curitiba, Brazil; Investigational Site Number 076004, Fortaleza, Brazil; Investigational Site Number 076001, Porto Alegre, Brazil; Investigational Site Number 076003, São Paulo, Brazil"
NCT05433298,Paulo Brofman,"Paulo Roberto Slud Brofman, Curitiba, Brazil"
NCT02519699,Federal University of São Paulo,"Hospital São Paulo - Universidade Federal de São Paulo, São Paulo, Brazil"
NCT01335321,University of Sao Paulo General Hospital,"Instituto de Ortopedia e Traumatologia do Hospital das Clínicas da Universidade de São Paulo, São Paulo, Brazil"
NCT03382626,University of Sao Paulo General Hospital,"Ambulatório de Reabilitação Cognitiva do Hospital das Clínicas da Universidade de São Paulo, São Paulo, Brazil"
NCT02014155,University of Santa Cruz do Sul,"Universidade de Santa Cruz do Sul, Santa Cruz do Sul, Brazil"
NCT06002126,Weill Medical College of Cornell University,"University of São Paulo, São Paulo, Brazil"
NCT03324035,University of Sao Paulo,"Hospital Das Clínicas da Faculdade de Medicina da USP, São Paulo, Brazil"
NCT02474498,"University of Campinas, Brazil","Piracicaba Dental School, State University of Campinas, Piracicaba, Brazil"
NCT01468987,Eli Lilly and Company,"For additional information regarding investigative sites for this trial, contact 1-877-CTLILLY (1-877-285-4559, 1-317-615-4559) Mon - Fri from 9 AM to 5 PM Eastern Time (UTC/GMT - 5 hours, EST), or speak with your personal physician., Aparecida de Goiânia, Brazil; For additional information regarding investigative sites for this trial, contact 1-877-CTLILLY (1-877-285-4559, 1-317-615-4559) Mon - Fri from 9 AM to 5 PM Eastern Time (UTC/GMT - 5 hours, EST), or speak with your personal physician., Brasília, Brazil"
NCT04349514,Monash University,"Lab of Neuroimaging and Dept of Neurology, University of Campinas (UNICAMP), São Paulo, Brazil"
